{
  "schemaVersion": "1.0.0",
  "purpose": "A reusable visual style database for generating distinctive WordPress block themes, style variations, patterns, and theme.json starter tokens.",
  "wordpressTarget": "WordPress block themes using theme.json version 3 concepts, with guidance that can be adapted for classic themes.",
  "sourceNotes": [
    {
      "label": "WordPress theme.json version 3 reference",
      "url": "https://developer.wordpress.org/block-editor/reference-guides/theme-json-reference/theme-json-living/"
    },
    {
      "label": "WordPress introduction to theme.json",
      "url": "https://developer.wordpress.org/themes/global-settings-and-styles/introduction-to-theme-json/"
    },
    {
      "label": "WordPress color settings",
      "url": "https://developer.wordpress.org/themes/global-settings-and-styles/settings/color/"
    },
    {
      "label": "WordPress typography settings",
      "url": "https://developer.wordpress.org/themes/global-settings-and-styles/settings/typography/"
    }
  ],
  "tokenContract": {
    "paletteRoles": [
      "base",
      "contrast",
      "primary",
      "secondary",
      "tertiary",
      "accent",
      "muted"
    ],
    "themeJsonHints": [
      "Map palette tokens to settings.color.palette entries with stable slugs.",
      "Map display, body, and accent typography to settings.typography.fontFamilies.",
      "Use layout, spacing, and pattern notes to create templates, template parts, and block patterns.",
      "Keep appearanceTools enabled for exploratory themes, then lock down controls for production theme variants."
    ]
  },
  "styles": [
    {
      "id": "brutalist-editorial",
      "name": "Brutalist Editorial",
      "status": "ready",
      "summary": "A raw, type-led publishing style with stark blocks, exposed structure, and a deliberately uncompromising visual rhythm.",
      "tags": [
        "editorial",
        "culture",
        "high-contrast",
        "typographic"
      ],
      "bestFor": [
        "independent magazines",
        "critical essays",
        "artist collectives",
        "conference microsites"
      ],
      "avoidFor": [
        "soft wellness brands",
        "luxury retail",
        "child-focused sites"
      ],
      "mood": [
        "direct",
        "literate",
        "unvarnished",
        "urgent"
      ],
      "designDna": [
        "oversized headlines",
        "hard borders",
        "asymmetric columns",
        "visible content hierarchy",
        "minimal decoration"
      ],
      "palette": {
        "strategy": "Near monochrome with one acidic signal color for links, calls to action, and issue labels.",
        "tokens": [
          {
            "role": "base",
            "name": "Newsprint",
            "slug": "newsprint",
            "hex": "#F6F2E8"
          },
          {
            "role": "contrast",
            "name": "Ink",
            "slug": "ink",
            "hex": "#111111"
          },
          {
            "role": "primary",
            "name": "Signal Red",
            "slug": "signal-red",
            "hex": "#E1261C"
          },
          {
            "role": "secondary",
            "name": "Concrete",
            "slug": "concrete",
            "hex": "#B9B6AB"
          },
          {
            "role": "muted",
            "name": "Dust",
            "slug": "dust",
            "hex": "#DED8C7"
          }
        ],
        "contrastNotes": "Use Ink on Newsprint for body copy. Reserve Signal Red for large text, underlines, borders, and filled buttons with Ink text."
      },
      "typography": {
        "display": "Condensed grotesk or impact sans stack: Impact, Haettenschweiler, Arial Narrow, sans-serif.",
        "body": "Readable sans stack: Arial, Helvetica Neue, Helvetica, sans-serif.",
        "accent": "Monospace stack: IBM Plex Mono, ui-monospace, SFMono-Regular, Menlo, monospace.",
        "scale": "Aggressive fluid scale with very large h1 and tight h2/h3 steps.",
        "usage": "Let display type do the visual work; use mono for issue numbers, dates, tags, and metadata."
      },
      "layout": {
        "density": "Dense but legible.",
        "grid": "Twelve-column desktop grid with abrupt two-column article intros and full-width pull quotes.",
        "rhythm": "Tight vertical rhythm with generous breaks before major sections.",
        "navigation": "Plain text nav in a hard bordered header, no decorative logo lockup required.",
        "hero": "Huge title, small deck, and one uncompromising image or flat color block."
      },
      "imagery": {
        "subjects": [
          "documentary photography",
          "scanned paper",
          "raw event images",
          "black-and-white portraits"
        ],
        "treatment": "High contrast, little smoothing, occasional halftone or xerox texture.",
        "crop": "Uncomfortable crops are acceptable when the headline remains dominant."
      },
      "components": {
        "buttons": "Rectangular, hard-border, uppercase or mono labels.",
        "cards": "Article cards use border-only containers or no container, with metadata pinned to the top.",
        "forms": "Square inputs with thick borders, visible labels, and blunt error states.",
        "special": [
          "issue masthead",
          "running ticker",
          "manifesto pull quote",
          "related essays index"
        ]
      },
      "wordpress": {
        "themeJsonPresetHints": [
          "Disable defaultPalette and register five high-control color presets.",
          "Enable fluid typography and define a display size that can reach poster scale.",
          "Set core/post-title and core/query-title styles to the display family."
        ],
        "patternIdeas": [
          "issue hero",
          "bordered article index",
          "manifesto quote band",
          "author debate pair"
        ],
        "templateFocus": [
          "home",
          "single",
          "archive",
          "search"
        ],
        "blockStyleTargets": [
          "core/query",
          "core/post-title",
          "core/pullquote",
          "core/navigation",
          "core/group"
        ]
      },
      "accessibility": [
        "Avoid long uppercase paragraphs.",
        "Keep line length under 75 characters in article bodies.",
        "Use hover styles that do not rely only on red."
      ],
      "antiPatterns": [
        "soft shadows",
        "rounded cards",
        "pastel gradients",
        "decorative stock imagery"
      ],
      "promptSeeds": [
        "raw independent magazine",
        "hard grid editorial system",
        "oversized black typography",
        "acid red issue labels"
      ]
    },
    {
      "id": "quiet-saas",
      "name": "Quiet SaaS",
      "status": "ready",
      "summary": "A restrained operational interface style for product sites, docs portals, and app-adjacent marketing that needs trust without visual noise.",
      "tags": [
        "saas",
        "product",
        "b2b",
        "minimal"
      ],
      "bestFor": [
        "software companies",
        "analytics tools",
        "developer platforms",
        "service dashboards"
      ],
      "avoidFor": [
        "music festivals",
        "maximalist campaigns",
        "youth culture brands"
      ],
      "mood": [
        "calm",
        "precise",
        "capable",
        "unobtrusive"
      ],
      "designDna": [
        "subtle dividers",
        "compact hierarchy",
        "clear tables",
        "restrained surfaces",
        "system-like spacing"
      ],
      "palette": {
        "strategy": "Neutral interface base with a measured blue-green primary and amber warning accent.",
        "tokens": [
          {
            "role": "base",
            "name": "Canvas",
            "slug": "canvas",
            "hex": "#F8FAF9"
          },
          {
            "role": "contrast",
            "name": "Graphite",
            "slug": "graphite",
            "hex": "#18201E"
          },
          {
            "role": "primary",
            "name": "Teal Signal",
            "slug": "teal-signal",
            "hex": "#147D78"
          },
          {
            "role": "secondary",
            "name": "Mist",
            "slug": "mist",
            "hex": "#E6ECEA"
          },
          {
            "role": "accent",
            "name": "Amber State",
            "slug": "amber-state",
            "hex": "#B66B00"
          }
        ],
        "contrastNotes": "Use Graphite text on Canvas or Mist. Teal Signal works for filled controls with white or Canvas text after contrast testing."
      },
      "typography": {
        "display": "Modern humanist sans: Inter, Source Sans 3, system-ui, sans-serif.",
        "body": "System UI stack for crisp product copy.",
        "accent": "Mono stack for metrics, version numbers, and code fragments.",
        "scale": "Modest fluid scale with restrained headings and compact labels.",
        "usage": "Use weight and spacing instead of decorative type shifts."
      },
      "layout": {
        "density": "Moderately dense.",
        "grid": "Twelve-column grid with narrow copy columns and structured product panels.",
        "rhythm": "Consistent 8px spacing logic with larger section bands.",
        "navigation": "Sticky product nav with compact button group and clear active state.",
        "hero": "App-like first viewport with product evidence, stats, and one primary action."
      },
      "imagery": {
        "subjects": [
          "real product screenshots",
          "data tables",
          "workflow diagrams",
          "team process photos"
        ],
        "treatment": "Clean, well-lit, minimally cropped. Avoid fake abstract dashboards.",
        "crop": "Frame interfaces straight-on with enough surrounding context to inspect them."
      },
      "components": {